{
  "schema_version": 1,
  "id": "ollama-qwen-coder",
  "provider": "ollama",
  "protocol": "ollama-chat",
  "base_url": "http://127.0.0.1:11434",
  "models_path": "/api/tags",
  "chat_path": "/api/chat",
  "structured_output": "ollama-json-schema",
  "model": "qwen2.5-coder",
  "temperature": 0.0,
  "max_tokens": 4096,
  "timeout_seconds": 180,
  "max_response_bytes": 2097152,
  "verify_tls": true,
  "allow_remote": false,
  "api_key_env": null,
  "headers": {}
}
